date_utc,headline,summary_80w,region,country,category,subtopic,capacity_MW,storage_MWh,project_stage,tariff_or_price_local,tariff_or_price_usd,entities,location,effective_date,impact_score_1to5,tags,source_name,source_url,reliability,notes
2026-05-26,Fortescue begins construction on 650MWh Cloudbreak battery storage system in Western Australia,"Mining giant Fortescue has commenced construction on a 650MWh battery energy storage system at Cloudbreak in Western Australia's Pilbara region, alongside the 690MW Turner River solar PV power plant.",Global,,project,,0,0,NA,,,[],"{'state_or_länder': '', 'city': '', 'grid_zone': ''}",2026-05-26,4,"['utility-scale', 'PV', 'storage']",Energy Storage News,https://www.energy-storage.news/fortescue-begins-construction-on-650mwh-cloudbreak-battery-storage-system-in-western-australia/,trade,
2026-05-26,Blue Elephant Energy starts building 268MW Germany solar plant,"German developer Blue Elephant Energy has begun constructing a 268MW solar PV plant in Germany. Power from the project will be bought by Germany train operator, Deutsche Bahn.",Germany,DE,project,,0,0,NA,,,[],"{'state_or_länder': '', 'city': '', 'grid_zone': ''}",2026-05-26,3,"['utility-scale', 'PV']",PV-Tech,https://www.pv-tech.org/blue-elephant-energy-starts-building-268mw-germany-solar-plant/,trade,
2026-05-26,GCL SI signs 1GW module supply deal with Thailand’s Getz Energy,"GCL SI has signed a 1GW module supply agreement with Thailand’s Getz Energy, a subsidiary of utility GPSC.",Global,,tech,,0,0,NA,,,[],"{'state_or_länder': '', 'city': '', 'grid_zone': ''}",2026-05-26,3,['utility-scale'],PV-Tech,https://www.pv-tech.org/gcl-si-signs-1gw-module-supply-deal-thailands-getz-energy/,trade,
2026-05-26,CATL supplying 1.5GWh for Grenergy’s long-term tolled Spanish BESS projects,"CATL will supply the BESS units for Grenergy's two large-scale energy storage projects in Spain, both of which have decade-long tolls.",Global,,project,,0,0,NA,,,[],"{'state_or_länder': '', 'city': '', 'grid_zone': ''}",2026-05-26,3,"['utility-scale', 'storage']",Energy Storage News,https://www.energy-storage.news/catl-supplying-1-5gwh-for-grenergys-long-term-tolled-spanish-bess-projects/,trade,
2026-05-26,DC vs AC coupling: which is best for co-locating your BESS and solar setups?,Solar-plus-storage projects are proliferating across the globe and necessitate a choice between DC and AC coupling. In this piece we look at the differences and pros and cons of each.,Global,,project,,0,0,NA,,,[],"{'state_or_länder': '', 'city': '', 'grid_zone': ''}",2026-05-26,3,"['utility-scale', 'PV', 'storage']",Energy Storage News,https://www.energy-storage.news/dc-vs-ac-coupling-which-is-best-for-co-locating-your-bess-and-solar-setups/,trade,
2026-05-26,Securing India’s battery supply chain is more critical than ever,"India is seeing its first major grid-scale battery storage deployments, but efforts to domesticate the upstream supply chain are still at an early stage.",India,IN,tech,,0,0,NA,,,[],"{'state_or_länder': '', 'city': '', 'grid_zone': ''}",2026-05-26,3,"['utility-scale', 'storage']",Energy Storage News,https://www.energy-storage.news/securing-indias-battery-supply-chain-is-more-critical-than-ever/,trade,
2026-05-26,Gujarat Industries Power Co seeks bids for 120MWh vanadium flow battery pilot project,Gujarat Industries Power Co Ltd (GIPCL) is holding a competitive solicitation for a large-scale vanadium redox flow battery (VRFB) energy storage project in western India.,India,IN,tender,,0,0,NA,,,[],"{'state_or_länder': '', 'city': '', 'grid_zone': ''}",2026-05-26,3,"['utility-scale', 'storage']",Energy Storage News,https://www.energy-storage.news/gujarat-industries-power-co-seeks-bids-for-120mwh-vanadium-flow-battery-pilot-project/,trade,
2026-05-26,"Passive bidding strategy delivers AU$743,000 monthly revenue for Swanbank BESS in Australia","Queensland's Swanbank battery energy storage system (BESS) earned AU$743,000 (US$532,608) in dispatch revenue last month, more than double the AU$306,000 generated by the Victorian Big Battery over the same period in Australia.",Global,,tender,,0,0,NA,,,[],"{'state_or_länder': '', 'city': '', 'grid_zone': ''}",2026-05-26,3,"['utility-scale', 'storage']",Energy Storage News,https://www.energy-storage.news/passive-bidding-strategy-delivers-au743000-monthly-revenue-for-swanbank-bess-in-australia/,trade,
2026-05-26,Battery storage dominates Australia’s Capacity Investment Scheme Tender 7 as hybrid projects secure 7.9GWh,"Battery energy storage systems (BESS) have emerged as the defining feature of Australia's Capacity Investment Scheme (CIS) Tender 7, with 2GW/7.9GWh of co-located energy storage successful.",Global,,tender,,0,0,NA,,,[],"{'state_or_länder': '', 'city': '', 'grid_zone': ''}",2026-05-26,3,"['utility-scale', 'PV+BESS', 'storage']",Energy Storage News,https://www.energy-storage.news/battery-storage-dominates-australias-capacity-investment-scheme-tender-7-as-hybrid-projects-secure-7-9gwh/,trade,
2026-05-26,Australia becomes the ‘world’s third-largest utility-scale battery storage market’,"Australia has emerged as the world's third-largest utility-scale battery energy storage market, with 4.3GW of large-scale battery storage systems reaching financial close in 2025.",Global,,tech,,0,0,NA,,,[],"{'state_or_länder': '', 'city': '', 'grid_zone': ''}",2026-05-26,3,"['utility-scale', 'storage']",Energy Storage News,https://www.energy-storage.news/australia-becomes-the-worlds-third-largest-utility-scale-battery-storage-market/,trade,
2026-05-25,Fortescue starts construction on Western Australia’s ‘largest solar PV power plant’,Mining giant Fortescue has begun construction on the 690MW Turner River solar PV power plant in Western Australia's Pilbara region.,Global,,project,,0,0,NA,,,[],"{'state_or_länder': '', 'city': '', 'grid_zone': ''}",2026-05-25,4,"['utility-scale', 'PV']",PV-Tech,https://www.pv-tech.org/fortescue-starts-construction-on-western-australias-largest-solar-pv-power-plant/,trade,
2026-05-25,Australia awards 7.8GW of renewable energy under Capacity Investment Scheme Tender 7,"Australia's CIS Tender 7 has seen 19 successful projects, which will deliver 7.8GW of renewable energy generation across the NEM.",Global,,tender,,0,0,NA,,,[],"{'state_or_länder': '', 'city': '', 'grid_zone': ''}",2026-05-25,3,['utility-scale'],PV-Tech,https://www.pv-tech.org/australia-awards-7-8gw-of-renewable-energy-under-capacity-investment-scheme-tender-7/,trade,
2026-05-25,BloombergNEF ups BESS forecast as renewables add resilience from fossil fuel price shocks,"The transition to new energy technologies, including grid-scale and vehicle batteries, can help fossil-fuel-dependent countries improve their energy security.",Global,,price,,0,0,NA,,,[],"{'state_or_länder': '', 'city': '', 'grid_zone': ''}",2026-05-25,3,"['utility-scale', 'storage']",Energy Storage News,https://www.energy-storage.news/bloombergnef-ups-bess-forecast-as-renewables-add-resilience-from-fossil-fuel-price-shocks/,trade,
2026-05-25,"250MW/1,000MWh Ontario BESS begins commercial operations, potential expansion ahead","US-headquartered clean energy solutions provider Ameresco’s joint venture (JV) with power producer Atura Power, has begun commercial operations at a 250MW/1,000MWh energy storage project in Ontario, Canada.",Global,,project,,0,0,NA,,,[],"{'state_or_länder': '', 'city': '', 'grid_zone': ''}",2026-05-25,3,"['utility-scale', 'storage']",Energy Storage News,https://www.energy-storage.news/250mw-1000mwh-ontario-bess-begins-commercial-operations-potential-expansion-ahead/,trade,
2026-05-25,"US installed 9.7GWh of new BESS in Q1 2026, SEIA reports","The US installed 9.7GWh of new battery energy storage system (BESS) capacity, according to the US trade association group, the Solar Energy Industries Association (SEIA).",Global,,tech,,0,0,NA,,,[],"{'state_or_länder': '', 'city': '', 'grid_zone': ''}",2026-05-25,3,"['utility-scale', 'PV', 'storage']",Energy Storage News,https://www.energy-storage.news/us-installed-9-7gwh-of-new-bess-in-q1-2026-seia-reports/,trade,
2026-05-25,Contact Energy switches on 200MWh battery storage system in New Zealand,"Contact Energy has brought online its first grid-scale BESS, a 100MW/200MWh installation at New Zealand Steel's Glenbrook site.",Global,,tech,,0,0,NA,,,[],"{'state_or_länder': '', 'city': '', 'grid_zone': ''}",2026-05-25,3,"['utility-scale', 'storage']",Energy Storage News,https://www.energy-storage.news/contact-energy-switches-on-200mwh-battery-storage-system-in-new-zealand/,trade,
2026-05-22,Masdar picks Sungrow as supplier for world’s largest 24/7 renewable energy project in UAE,Masdar has selected Sungrow for the world’s first gigawatt-scale 24/7 dispatchable renewable energy project in the United Arab Emirates (UAE).,Global,,project,,0,0,NA,,,[],"{'state_or_länder': '', 'city': '', 'grid_zone': ''}",2026-05-22,5,['utility-scale'],Energy Storage News,https://www.energy-storage.news/masdar-picks-sungrow-as-supplier-for-worlds-largest-24-7-renewable-energy-project-in-uae/,trade,
2026-05-22,Spearmint Energy secures US$450 million for 600MWh Texas BESS project,Battery storage developer and operator Spearmint Energy has closed a US$450 million financing to support its 300MW/600MWh Red Egret battery energy storage system (BESS) project.,Global,,project,,0,0,NA,,,[],"{'state_or_länder': '', 'city': '', 'grid_zone': ''}",2026-05-22,4,"['utility-scale', 'storage']",Energy Storage News,https://www.energy-storage.news/spearmint-energy-secures-us450-million-for-600mwh-texas-bess-project/,trade,
2026-05-22,Can Europe become the next major market for Indian solar manufacturers?,"As trade dynamics shift, could the EU become the next big market for Indian solar suppliers? PV Tech Premium explores the outlook with Wood Mackenzie’s Yana Hryshko and IEEFA’s Charith Konda.",India,IN,market,,0,0,NA,,,[],"{'state_or_länder': '', 'city': '', 'grid_zone': ''}",2026-05-22,3,"['utility-scale', 'PV']",PV-Tech,https://www.pv-tech.org/can-europe-become-the-next-major-market-for-indian-solar-manufacturers/,trade,
2026-05-22,‘We’re waiting on robotics for a big paradigm shift’,PV Talk: Frank Oudheusden explains how robotics could create a paradigm shift and improvements in PV system optimisation for extreme weather.,Global,,market,,0,0,NA,,,[],"{'state_or_länder': '', 'city': '', 'grid_zone': ''}",2026-05-22,3,"['utility-scale', 'PV']",PV-Tech,https://www.pv-tech.org/were-waiting-on-robotics-for-a-big-paradigm-shift/,trade,
2026-05-22,"Giant NextEra-Dominion merger should be met with ‘caution’ to avoid rate increases, groups warn","The planned merger of US utilities NextEra Energy and Dominion Energy should be met with “caution” by state lawmakers, according to a number of US clean energy and political non-profit groups.",Global,,market,,0,0,NA,,,[],"{'state_or_länder': '', 'city': '', 'grid_zone': ''}",2026-05-22,3,['utility-scale'],PV-Tech,https://www.pv-tech.org/giant-nextera-dominion-merger-should-be-met-with-caution-to-avoid-rate-increases-groups-warn/,trade,
2026-05-22,Polar Racking launches solar O&M services in North America and Caribbean,Polar Racking has launched a Solar Asset Management Division to support operations and maintenance (O&#038;M) activities across utility-scale and commercial solar projects in North America and the Caribbean.,Global,,project,,0,0,NA,,,[],"{'state_or_länder': '', 'city': '', 'grid_zone': ''}",2026-05-22,3,"['utility-scale', 'PV']",PV-Tech,https://www.pv-tech.org/polar-racking-launches-solar-om-services-in-north-america-and-caribbean/,trade,
2026-05-22,"Shorter-term PPAs, sophisticated offtake structures lead discussions at Renewables Procurement & Revenue 2026","On Site Energy's Martin Gaffney said 'We’ve seen PPAs as low as four years,' during this year’s Renewables Procurement &#038; Revenue summit.",Global,,market,,0,0,NA,,,[],"{'state_or_länder': '', 'city': '', 'grid_zone': ''}",2026-05-22,3,['utility-scale'],PV-Tech,https://www.pv-tech.org/shorter-term-ppas-sophisticated-offtake-structures-lead-renewables-procurement-revenue-2026/,trade,
2026-05-22,Solar PV to dominate ‘electricity-led era’ of the future – BloombergNEF,"The world is entering an ‘electricity-led era’, with solar PV set to become the globe’s largest electricity generation technology by 2032, according to Bloomberg New Energy Finance (BloombergNEF).",Global,,tech,,0,0,NA,,,[],"{'state_or_länder': '', 'city': '', 'grid_zone': ''}",2026-05-22,3,"['utility-scale', 'PV']",PV-Tech,https://www.pv-tech.org/solar-pv-to-dominate-electricity-led-era-of-the-future-bloombergnef/,trade,
2026-05-22,LDES investor Frontier Power acquires 480MWh Texas BESS portfolio from Bimergen,Long-duration energy storage (LDES) development and investment company Frontier Power USA (FPUSA) has acquired a 480MWh battery energy storage system (BESS) portfolio from developer-operator Bimergen Energy.,Global,,tech,,0,0,NA,,,[],"{'state_or_länder': '', 'city': '', 'grid_zone': ''}",2026-05-22,3,"['utility-scale', 'storage']",Energy Storage News,https://www.energy-storage.news/ldes-investor-frontier-power-acquires-480mwh-texas-bess-portfolio-from-bimergen/,trade,
2026-05-22,Germany market participants starting to price 2029-onwards projects despite uncertainty,"The situation and uncertainty around grid connections and grid fees in Germany is evolving, possibly enabling market participants to look beyond the August 2029 grid fee exemption cut-off date - although uncertainty is still very high.",Germany,DE,project,,0,0,NA,,,[],"{'state_or_länder': '', 'city': '', 'grid_zone': ''}",2026-05-22,3,['utility-scale'],Energy Storage News,https://www.energy-storage.news/germany-market-participants-starting-to-price-2029-onwards-projects-despite-uncertainty/,trade,
2026-05-22,"EDF completes 120MWh Poland BESS; Eurus, NGEN and Aretis progress other CEE projects","EDF Power Solutions has commissioned a 50MW/120MWh BESS project in Poland, Eurus has done the same in Hungary, while NGEN and Aretis Group have financed and enlisted optimisers (respectively) for projects in Hungary, Romania, Poland, Slovenia and Latvia.",Global,,project,,0,0,NA,,,[],"{'state_or_länder': '', 'city': '', 'grid_zone': ''}",2026-05-22,3,"['utility-scale', 'storage']",Energy Storage News,https://www.energy-storage.news/edf-completes-120mwh-poland-bess-eurus-ngen-and-aretis-progress-other-cee-projects/,trade,
2026-05-21,"SAEL commissions 600MW solar projects in Andhra Pradesh, India","Indian renewable energy company SAEL has commissioned 600MW of solar project in Kurnool, Andhra Pradesh.",India,IN,project,,0,0,NA,,,[],"{'state_or_länder': '', 'city': '', 'grid_zone': ''}",2026-05-21,4,"['utility-scale', 'PV']",PV-Tech,https://www.pv-tech.org/sael-commissions-600mw-solar-projects-in-andhra-pradesh-india/,trade,
2026-05-21,ASEAN regulatory frameworks ‘must evolve’ to capture full value of battery storage,"“Policy and market frameworks must evolve” in ASEAN countries to unlock the full value of energy storage in the region’s energy transition, according to a new report.",Global,,policy,,0,0,NA,,,[],"{'state_or_länder': '', 'city': '', 'grid_zone': ''}",2026-05-21,4,"['utility-scale', 'storage']",Energy Storage News,https://www.energy-storage.news/asean-regulatory-frameworks-must-evolve-to-capture-full-value-of-battery-storage/,trade,
2026-05-21,"Edify Energy to proceed with 2,400MWh solar-plus-storage sites in Australia","Edify Energy has reached financial close on two solar-plus-storage projects in Queensland, totalling 600MW/2,400MWh of BESS.",Global,,project,,0,0,NA,,,[],"{'state_or_länder': '', 'city': '', 'grid_zone': ''}",2026-05-21,4,"['utility-scale', 'PV', 'storage']",Energy Storage News,https://www.energy-storage.news/edify-energy-to-proceed-with-2400mwh-solar-plus-storage-sites-in-australia/,trade,
2026-05-21,Stewart Glass to expand Ohio solar glass facility,US solar glass producer Stewart Glass is expanding its facility in Ohio with a new production line expected in 2027.,Global,,market,,0,0,NA,,,[],"{'state_or_länder': '', 'city': '', 'grid_zone': ''}",2026-05-21,3,"['utility-scale', 'PV']",PV-Tech,https://www.pv-tech.org/stewart-glass-to-expand-ohio-solar-glass-facility/,trade,
2026-05-21,Grenergy secures solar-plus-storage PPA in the US,Spanish independent power producer Grenergy has signed a long-term hybrid power purchase agreement (PPA) with US utility Georgia Power.,Global,,market,,0,0,NA,,,[],"{'state_or_länder': '', 'city': '', 'grid_zone': ''}",2026-05-21,3,"['utility-scale', 'PV+BESS', 'PV', 'storage']",PV-Tech,https://www.pv-tech.org/grenergy-secures-solar-plus-storage-ppa-in-the-us/,trade,
2026-05-21,"Solving offtakers’ challenges should be the main goal of solar-plus-storage developers, say industry experts",Developers of co-located solar-plus-storage projects need to ensure their projects are designed to ‘solve’ the challenges faced by offtakers.,Global,,project,,0,0,NA,,,[],"{'state_or_länder': '', 'city': '', 'grid_zone': ''}",2026-05-21,3,"['utility-scale', 'PV', 'storage']",PV-Tech,https://www.pv-tech.org/solving-offtakers-challenges-should-be-the-main-goal-solar-plus-storage-developers-industry-experts/,trade,
2026-05-21,Solar PV helped Europe avoid €10 billion in gas imports since Iran war started,"Europe has avoided €10 billion in gas imports since the start of the Iran war thanks to power generated from its solar PV fleet, according to research from SolarPower Europe.",Europe,EU,market,,0,0,NA,,,[],"{'state_or_länder': '', 'city': '', 'grid_zone': ''}",2026-05-21,3,"['utility-scale', 'PV']",PV-Tech,https://www.pv-tech.org/solar-pv-helped-europe-avoid-e10-billion-in-gas-imports-since-iran-war-started/,trade,
2026-05-21,"Speed to power, reduced cost and risk driving behind-the-meter PPAs",A panel at the Renewable Procurement and Revenue Summit in London discussed the benefits of the procurement structure.,Global,,market,,0,0,NA,,,[],"{'state_or_länder': '', 'city': '', 'grid_zone': ''}",2026-05-21,3,['utility-scale'],PV-Tech,https://www.pv-tech.org/speed-to-power-reduced-cost-and-risk-driving-behind-the-meter-ppas/,trade,
2026-05-21,‘Who can manage the risk?’: The central challenge in PPA negotiations,"Panellists addressed the challenges associated with signing a PPA, given the differences in priorities between the parties involved.",Global,,market,,0,0,NA,,,[],"{'state_or_länder': '', 'city': '', 'grid_zone': ''}",2026-05-21,3,['utility-scale'],PV-Tech,https://www.pv-tech.org/who-can-manage-the-risk-the-central-challenge-in-ppa-negotiations/,trade,
2026-05-21,Ocean Sun inks MoU to deploy utility-scale floating solar across Asia,Norwegian floating solar developer Ocean Sun has entered into a memorandum of understanding (MoU) with ACEN-Silverwolf to establish a framework for deploying utility-scale floating solar installations across selected Asian markets.,India,IN,market,,0,0,NA,,,[],"{'state_or_länder': '', 'city': '', 'grid_zone': ''}",2026-05-21,3,"['utility-scale', 'PV']",PV-Tech,https://www.pv-tech.org/ocean-sun-inks-mou-to-deploy-utility-scale-floating-solar-across-asia/,trade,
2026-05-21,Australia’s New South Wales launches ‘biggest renewable energy tender in the state’s history’,"New South Wales (NSW), Australia, has launched what it has described as its “biggest renewable energy tender in the state’s history”, seeking 2.5GW of renewable energy generation.",Global,,tender,,0,0,NA,,,[],"{'state_or_länder': '', 'city': '', 'grid_zone': ''}",2026-05-21,3,['utility-scale'],PV-Tech,https://www.pv-tech.org/australias-new-south-wales-launches-biggest-renewable-energy-tender-in-the-states-history/,trade,
2026-05-21,"Developers must become ‘a bit of a firefighter, sound expert, and light expert’: Addressing BESS safety and community opposition","At a recent industry event hosted by market research firm Wood Mackenzie, energy storage experts discussed their approaches to public engagement, especially around addressing fire and other safety concerns.",Global,,market,,0,0,NA,,,[],"{'state_or_länder': '', 'city': '', 'grid_zone': ''}",2026-05-21,3,"['utility-scale', 'storage']",Energy Storage News,https://www.energy-storage.news/developers-must-become-a-bit-of-a-firefighter-sound-expert-and-light-expert-addressing-bess-safety-and-community-opposition/,trade,
2026-05-21,"US ROUNDUP: BESS project advancements from OCI Energy, MN8 Energy, GridStor, Grenergy","In this US news roundup, OCI Energy, MN8 Energy, GridStor, and Grenergy advance battery energy storage system (BESS) projects in Texas, California, Colorado, and Georgia.",Global,,project,,0,0,NA,,,[],"{'state_or_länder': '', 'city': '', 'grid_zone': ''}",2026-05-21,3,"['utility-scale', 'storage']",Energy Storage News,https://www.energy-storage.news/us-roundup-bess-project-advancements-from-oci-energy-mn8-energy-gridstor-grenergy/,trade,
2026-05-21,"Invinity lands contract for 2.1GWh flow battery in Switzerland, share price soars 60%","Invinity Energy Systems has been enlisted to design and deliver the world's largest flow battery, for a data centre project in Switzerland currently under construction by Flexbase.",Global,,project,,0,0,NA,,,[],"{'state_or_länder': '', 'city': '', 'grid_zone': ''}",2026-05-21,3,"['utility-scale', 'storage']",Energy Storage News,https://www.energy-storage.news/invinity-lands-contract-for-2-1gwh-flow-battery-in-switzerland-share-price-soars-60/,trade,
2026-05-21,China’s HyperStrong deepens ties with European inverter manufacturer SMA for global utility-scale BESS projects,China-headquartered battery storage system integrator HyperStrong and German power electronics manufacturer SMA Solar have signed a strategic cooperation agreement.,Germany,DE,project,,0,0,NA,,,[],"{'state_or_länder': '', 'city': '', 'grid_zone': ''}",2026-05-21,3,"['utility-scale', 'PV', 'storage']",Energy Storage News,https://www.energy-storage.news/chinas-hyperstrong-deepens-ties-with-european-inverter-manufacturer-sma-for-global-utility-scale-bess-projects/,trade,
2026-05-21,"JA Solar appoints head of energy storage subsidiary, effective immediately","On May 20, JA Solar announced the appointment of Wang Junsheng as president of its energy storage subsidiary, with the appointment taking immediate effect.",Global,,market,,0,0,NA,,,[],"{'state_or_länder': '', 'city': '', 'grid_zone': ''}",2026-05-21,3,"['utility-scale', 'PV', 'storage']",Energy Storage News,https://www.energy-storage.news/ja-solar-appoints-head-of-energy-storage-subsidiary-effective-immediately/,trade,
2026-05-21,‘More complex trading strategies’ necessary for BESS to be profitable in the UK,"The UK’s NESO has cleared 150GW of BESS from its grid connection queues, according to figures from BloombergNEF.",Global,,market,,0,0,NA,,,[],"{'state_or_länder': '', 'city': '', 'grid_zone': ''}",2026-05-21,3,"['utility-scale', 'storage']",Energy Storage News,https://www.energy-storage.news/uks-neso-clears-150gw-bess-grid-connection-queue-financial-challenges-remain/,trade,
2026-05-21,Equis launches GreenPoint Energy with 2.5GW of BESS and wind projects across Australia’s NEM,"Singapore-based Equis has launched GreenPoint Energy, a wholly owned subsidiary consolidating its Australian renewable energy and battery storage operations under a dedicated platform with a 2.5GW portfolio of 12 battery energy storage systems (BESS) and wind projects across every National Energy Market (NEM)-connected state.",Global,,project,,0,0,NA,,,[],"{'state_or_länder': '', 'city': '', 'grid_zone': ''}",2026-05-21,3,"['utility-scale', 'wind', 'storage']",Energy Storage News,https://www.energy-storage.news/equis-launches-greenpoint-energy-with-2-5gw-of-bess-and-wind-projects-across-australias-nem/,trade,
2026-05-21,EDP wins AU$3 million ARENA funding for bushfire-resilient microgrid in regional Australia,EDP Renewables Australia has secured AU$3 million in funding from ARENA to develop the Braidwood Renewable Microgrid Project.,Global,,project,,0,0,NA,,,[],"{'state_or_länder': '', 'city': '', 'grid_zone': ''}",2026-05-21,3,['utility-scale'],Energy Storage News,https://www.energy-storage.news/edp-wins-au3-million-arena-funding-for-bushfire-resilient-microgrid-in-regional-australia/,trade,
2026-05-20,Enbridge to build 365MW/1.6GWh solar-plus-storage project in Wyoming for Meta data centre,"Canadian energy firm Enbridge will develop a 365MW/1,600MWh solar-plus-storage project in Wyoming, US, as part of an ongoing partnership with tech and data giant Meta.",Global,,project,,0,0,NA,,,[],"{'state_or_länder': '', 'city': '', 'grid_zone': ''}",2026-05-20,4,"['utility-scale', 'PV', 'storage']",PV-Tech,https://www.pv-tech.org/enbridge-to-build-365mw-1-6gwh-solar-plus-storage-project-in-wyoming-for-meta-data-centre/,trade,
2026-05-20,CAISO approves transmission plan enabling 45GW of new solar PV,"The California Independent System Operator (CAISO) Board of Governors has approved the ISO’s 2025-2026 transmission plan, which accommodates 45 GW of new solar PV.",Global,,market,,0,0,NA,,,[],"{'state_or_länder': '', 'city': '', 'grid_zone': ''}",2026-05-20,4,"['utility-scale', 'PV']",PV-Tech,https://www.pv-tech.org/caiso-approves-transmission-plan-enabling-45gw-of-new-solar-pv/,trade,
2026-05-20,Lack of European policy clarity forces Carbon to shut down 5GW module plant plans in France,European solar manufacturing start-up Carbon has abandoned its plan to build a 5GW module assembly plant in France due to a lack of conditions required for EU-made solar PV manufacturing.,Europe,EU,policy,,0,0,NA,,,[],"{'state_or_länder': '', 'city': '', 'grid_zone': ''}",2026-05-20,4,"['utility-scale', 'PV']",PV-Tech,https://www.pv-tech.org/lack-of-european-policy-clarity-forces-carbon-to-shut-down-5gw-module-plant-plans-in-france/,trade,
