date_utc,headline,summary_80w,region,country,category,subtopic,capacity_MW,storage_MWh,project_stage,tariff_or_price_local,tariff_or_price_usd,entities,location,effective_date,impact_score_1to5,tags,source_name,source_url,reliability,notes
2026-06-19,BLT Energy bags development approval for 4.8GWh Red Gully BESS in Western Australia,"Developer BLT Energy has received development approval for the 800MW/4,800MWh Red Gully BESS in Western Australia.",Global,,market,,0,0,NA,,,[],"{'state_or_länder': '', 'city': '', 'grid_zone': ''}",2026-06-19,4,"['utility-scale', 'storage']",Energy Storage News,https://www.energy-storage.news/blt-energy-bags-development-approval-for-4-8gwh-red-gully-bess-in-western-australia/,trade,
2026-06-19,"Eku Energy submits two 1,200MWh battery storage projects to Australia’s EPBC Act","Energy storage developer Eku Energy has submitted two BESS, each sized at 300MW and 1,200MWh, for assessment under Australia's EPBC Act.",Global,,project,,0,0,NA,,,[],"{'state_or_länder': '', 'city': '', 'grid_zone': ''}",2026-06-19,4,"['utility-scale', 'storage']",Energy Storage News,https://www.energy-storage.news/eku-energy-submits-two-1200mwh-battery-storage-projects-to-australias-epbc-act/,trade,
2026-06-19,ARENA commits AU$95.4 million to extend Australian Centre for Advanced Photovoltaics to 2033,"The Australian Renewable Energy Agency (ARENA) has committed an additional AU$95.4 million (US$66.8 million) in funding to the Australian Centre for Advanced Photovoltaics (ACAP), extending the research programme's operations to 2033.",Global,,market,,0,0,NA,,,[],"{'state_or_länder': '', 'city': '', 'grid_zone': ''}",2026-06-19,3,['utility-scale'],PV-Tech,https://www.pv-tech.org/arena-commits-au95-4-million-to-extend-australian-centre-for-advanced-photovoltaics-to-2033/,trade,
2026-06-19,"Module quality, supply chain compliance and US HJT adoption: PV ModuleTech USA’s key takeaways","Module quality and reliability concerns, HJT, manufacturing in Africa and hail were among the key topics discussed at PV ModuleTech USA.",Global,,tech,,0,0,NA,,,[],"{'state_or_länder': '', 'city': '', 'grid_zone': ''}",2026-06-19,3,"['utility-scale', 'PV']",PV-Tech,https://www.pv-tech.org/module-quality-supply-chain-compliance-and-us-hjt-adoption-pv-moduletech-usas-key-takeaways/,trade,
2026-06-19,"Investment under uncertainty: How AI, volatility and real-options thinking are reshaping battery storage economics","Battery storage is effectively a hardware-backed multi-strategy trading platform, writes Partha Sharma, president of BBNR Capital Management.",Global,,tech,,0,0,NA,,,[],"{'state_or_länder': '', 'city': '', 'grid_zone': ''}",2026-06-19,3,"['utility-scale', 'storage']",Energy Storage News,https://www.energy-storage.news/investment-under-uncertainty-how-ai-volatility-and-real-options-thinking-are-reshaping-battery-storage-economics/,trade,
2026-06-18,Aiko signs 1.2GW all-back-contact solar module supply deal with Infinity Power,Aiko has signed a 1.2GW module supply deal with Infinity Power to supply modules for the latter’s Nefer Menya solar-plus-storage project.,Global,,project,,0,0,NA,,,[],"{'state_or_länder': '', 'city': '', 'grid_zone': ''}",2026-06-18,3,"['utility-scale', 'PV', 'storage']",PV-Tech,https://www.pv-tech.org/aiko-signs-1-2gw-all-back-contact-solar-module-supply-deal-infinity-power/,trade,
2026-06-18,Array upgrades DuraTrack system to support dual-row format,US tracker supplier Array Technologies has launched an enhanced version of its DuraTrack system that supports a two-row module format.,Global,,tech,,0,0,NA,,,[],"{'state_or_länder': '', 'city': '', 'grid_zone': ''}",2026-06-18,3,['utility-scale'],PV-Tech,https://www.pv-tech.org/array-upgrades-duratrack-system-to-support-dual-row-format/,trade,
2026-06-18,Sonnedix secures Spanish electricity supply licence,Sonnedix has received authorisation from Spain’s CNMC to operate as a licensed electricity trading and supply company in the country.,Global,,market,,0,0,NA,,,[],"{'state_or_länder': '', 'city': '', 'grid_zone': ''}",2026-06-18,3,['utility-scale'],PV-Tech,https://www.pv-tech.org/sonnedix-secures-spanish-electricity-supply-licence/,trade,
2026-06-18,Before you worry about voltage drops – worry about data drops,Data loss in PV project design can lead to inaccurate energy modelling and underperforming solar projects. Maksim Markevich examines how the industry can avoid these blind spots.,Global,,project,,0,0,NA,,,[],"{'state_or_länder': '', 'city': '', 'grid_zone': ''}",2026-06-18,3,"['utility-scale', 'PV']",PV-Tech,https://www.pv-tech.org/before-you-worry-about-voltage-drops-worry-about-data-drops/,trade,
2026-06-18,Scatec reaches financial close on 120MW Tunisian solar project,Norwegian independent power producer (IPP) Scatec has reached financial close for the 120MW Sidi Bouzid II solar PV project in Tunisia.,Global,,project,,0,0,NA,,,[],"{'state_or_länder': '', 'city': '', 'grid_zone': ''}",2026-06-18,3,"['utility-scale', 'PV']",PV-Tech,https://www.pv-tech.org/scatec-reaches-financial-close-on-120mw-tunisian-solar-project/,trade,
2026-06-18,Chrysalis acquires 357MWdc Atlas solar projects from Hanwha in US,Renewable energy investment platform Chrysalis Renewables LP (Chrysalis) has acquired the Atlas V and Atlas VI solar projects in the US.,Global,,project,,0,0,NA,,,[],"{'state_or_länder': '', 'city': '', 'grid_zone': ''}",2026-06-18,3,"['utility-scale', 'PV']",PV-Tech,https://www.pv-tech.org/chrysalis-acquires-357mwdc-atlas-solar-projects-from-hanwha-in-us/,trade,
2026-06-18,Oxford PV and Fraunhofer ISE combine technologies in new perovskite-silicon tandem module design,Oxford PV and Fraunhofer ISE have unveiled a module prototype that combines tandem perovskite-silicon and matrix shingle interconnection.,Germany,DE,tech,,0,0,NA,,,[],"{'state_or_länder': '', 'city': '', 'grid_zone': ''}",2026-06-18,3,"['utility-scale', 'PV']",PV-Tech,https://www.pv-tech.org/oxford-pv-and-fraunhofer-ise-combine-technologies-in-new-perovskite-silicon-tandem-module-design/,trade,
2026-06-18,Arizona court rules against bill increase for state’s residential solar users,The Arizona Court of Appeals has vacated a decision that Arizona utilities can impose additional charges on residential solar customers.,Global,,market,,0,0,NA,,,[],"{'state_or_länder': '', 'city': '', 'grid_zone': ''}",2026-06-18,3,"['utility-scale', 'PV']",PV-Tech,https://www.pv-tech.org/arizona-court-rules-against-bill-increase-states-residential-solar-users/,trade,
2026-06-18,‘The fundamentals are proven’: Enervest CEO on building floating solar on a live water utility reservoir,"In this interview with PV Tech Premium, Enervest CEO Ross Warby explains the demands of floating solar on a live water utility reservoir.",Global,,market,,0,0,NA,,,[],"{'state_or_länder': '', 'city': '', 'grid_zone': ''}",2026-06-18,3,"['utility-scale', 'PV']",PV-Tech,https://www.pv-tech.org/the-fundamentals-are-proven-enervest-ceo-on-building-floating-solar-on-a-live-water-utility-reservoir/,trade,
2026-06-18,"Lightsource bp, Contact Energy reach financial close on 171MWdc Glorit solar PV plant in New Zealand","Developer Lightsource bp has reached financial close on the 171MWdc Glorit solar PV power plant, north of Auckland, New Zealand.",Global,,market,,0,0,NA,,,[],"{'state_or_länder': '', 'city': '', 'grid_zone': ''}",2026-06-18,3,"['utility-scale', 'PV']",PV-Tech,https://www.pv-tech.org/lightsource-bp-contact-energy-reach-financial-close-on-171mwdc-glorit-solar-pv-plant-in-new-zealand/,trade,
2026-06-18,Australia’s ‘probable’ large-scale renewable energy pipeline surges to 32GW,"Australia's large-scale renewables pipeline has reached 32,277MW of probable generation capacity, according to the Clean Energy Regulator.",Global,,market,,0,0,NA,,,[],"{'state_or_länder': '', 'city': '', 'grid_zone': ''}",2026-06-18,3,['utility-scale'],PV-Tech,https://www.pv-tech.org/australias-probable-large-scale-renewable-energy-pipeline-surges-to-32gw/,trade,
2026-06-18,Enphase co-founder says solid-state transformer can ease data centre ‘power problems’,"Energy-Storage.news Premium speaks with co-founder and chief products officer of microinverter and home energy storage system supplier Enphase Energy, Raghu Belur, about the company’s recent focus on solid-state transformer technology.",Global,,tech,,0,0,NA,,,[],"{'state_or_länder': '', 'city': '', 'grid_zone': ''}",2026-06-18,3,"['utility-scale', 'storage']",Energy Storage News,https://www.energy-storage.news/enphase-co-founder-says-solid-state-transformer-can-ease-data-centre-power-problems/,trade,
2026-06-18,US sodium-ion startups form coalition to challenge China’s battery dominance,"A group of sodium-ion (Na-ion) battery-focused companies have launched a new industry coalition, the American Battery Leadership Coalition (ABLC).",Global,,tech,,0,0,NA,,,[],"{'state_or_länder': '', 'city': '', 'grid_zone': ''}",2026-06-18,3,"['utility-scale', 'storage']",Energy Storage News,https://www.energy-storage.news/us-sodium-ion-startups-form-coalition-to-challenge-chinas-battery-dominance/,trade,
2026-06-18,"Aypa Power brings 1,000MWh Arizona BESS online in utility Salt River Project’s busy June","Energy storage developer-operator Aypa Power and utility Salt River Project (SRP) have brought the 250MW/1,000MWh Pediment energy storage project online in Mesa, Arizona.",Global,,project,,0,0,NA,,,[],"{'state_or_länder': '', 'city': '', 'grid_zone': ''}",2026-06-18,3,"['utility-scale', 'storage']",Energy Storage News,https://www.energy-storage.news/aypa-power-brings-1000mwh-arizona-bess-online-in-utility-salt-river-projects-busy-june/,trade,
2026-06-18,Energy trader Second Foundation on owning projects and the ‘art’ of trading batteries in Germany,"We chat to Stephan Lehrke, head of Germany at Second Foundation, a Czech Republic-headquartered energy asset trading firm which is becoming an owner-operator of BESS.",Germany,DE,project,,0,0,NA,,,[],"{'state_or_länder': '', 'city': '', 'grid_zone': ''}",2026-06-18,3,"['utility-scale', 'storage']",Energy Storage News,https://www.energy-storage.news/energy-trader-second-foundation-on-owning-projects-and-the-art-of-trading-batteries-in-germany/,trade,
2026-06-18,CEE Roundup: EPCs complete CATL and Sungrow-supplied 600MWh Bulgaria projects,"Activity in Central and Eastern Europe (CEE) continues to accelerate, with two separate c.600MWh projects completed in Bulgaria by Solarpro &#038; CATL and Sunotec and Sungrow, plus around 800MWh of capacity progressed across Romania, Estonia, Lithuania, and Finland.",Europe,EU,project,,0,0,NA,,,[],"{'state_or_länder': '', 'city': '', 'grid_zone': ''}",2026-06-18,3,['utility-scale'],Energy Storage News,https://www.energy-storage.news/cee-roundup-epcs-complete-catl-and-sungrow-supplied-600mwh-bulgaria-projects/,trade,
2026-06-18,Fire and Rescue NSW mandates 240-minute fire resistance for lithium-ion battery storage rooms in data centres,Fire and Rescue NSW (FRNSW) in Australia has set out its requirements for lithium-ion battery storage rooms and diesel generator structures in data centres.,Global,,tech,,0,0,NA,,,[],"{'state_or_länder': '', 'city': '', 'grid_zone': ''}",2026-06-18,3,"['utility-scale', 'storage']",Energy Storage News,https://www.energy-storage.news/fire-and-rescue-nsw-mandates-240-minute-fire-resistance-for-lithium-ion-battery-storage-rooms-in-data-centres/,trade,
2026-06-18,Neoen Australia signs virtual battery deals for 2.3GWh Western Downs Battery,Neoen Australia has signed virtual battery agreements with energy retailers Nectr and SmartestEnergy for Stages 2 and 3 of the Western Downs Battery in Queensland.,Global,,tech,,0,0,NA,,,[],"{'state_or_länder': '', 'city': '', 'grid_zone': ''}",2026-06-18,3,"['utility-scale', 'storage']",Energy Storage News,https://www.energy-storage.news/neoen-australia-signs-virtual-battery-deals-for-540mwh-western-downs-battery/,trade,
2026-06-17,Nextpower expands tracker portfolio with NX Gemini 2P launch,Solar PV solutions provider Nextpower has launched its redesigned NX Gemini two-in-portrait (2P) solar tracker.,Global,,market,,0,0,NA,,,[],"{'state_or_länder': '', 'city': '', 'grid_zone': ''}",2026-06-17,3,"['utility-scale', 'PV']",PV-Tech,https://www.pv-tech.org/nextpower-expands-tracker-portfolio-with-nx-gemini-2p-launch/,trade,
2026-06-17,"DISTRIBUTED SOLAR ROUND-UP: US developers secure funding across Maryland, Delaware and Connecticut","Distributed solar developers including MCEC, Aligned Climate Capital and Catalyst Power have secured funding across US projects.",Global,,project,,0,0,NA,,,[],"{'state_or_länder': '', 'city': '', 'grid_zone': ''}",2026-06-17,3,"['utility-scale', 'PV']",PV-Tech,https://www.pv-tech.org/distributed-solar-round-up-us-developers-secure-funding-across-maryland-delaware-and-connecticut/,trade,
2026-06-17,Alluvial Power brings 150MW Kansas solar project online,"Independent power producer (IPP) Alluvial Power has reached commercial operation at its 150MWac project in Ford County, Kansas.",Global,,project,,0,0,NA,,,[],"{'state_or_länder': '', 'city': '', 'grid_zone': ''}",2026-06-17,3,"['utility-scale', 'PV']",PV-Tech,https://www.pv-tech.org/alluvial-power-brings-150mw-kansas-solar-project-online/,trade,
2026-06-17,"INDIA ROUND-UP: Waaree secures module orders, Bondada wins EPC contract and Navitas plans cell plant","Navitas announced investment, Bondada secured EPC contract, SolarSquare raised US$53 million, Gujarat Inject and Waaree won module orders.",India,IN,tech,,0,0,NA,,,[],"{'state_or_länder': '', 'city': '', 'grid_zone': ''}",2026-06-17,3,['utility-scale'],PV-Tech,https://www.pv-tech.org/india-round-up-waaree-secures-module-orders-bondada-wins-epc-contract-navitas-plans-cell-plant/,trade,
2026-06-17,Fonterra signs virtual PPA with NZ Clean Energy for 129MW Darfield solar-plus-storage project in New Zealand,Foresight Group-backed developer NZ Clean Energy (NZCE) and Fonterra have signed a long-term virtual power purchase agreement (PPA) under which the dairy cooperative will purchase electricity generated by NZCE's Darfield solar-plus-storage project in Canterbury.,Global,,project,,0,0,NA,,,[],"{'state_or_länder': '', 'city': '', 'grid_zone': ''}",2026-06-17,3,"['utility-scale', 'PV', 'storage']",PV-Tech,https://www.pv-tech.org/fonterra-signs-virtual-ppa-with-nz-clean-energy-for-129mw-darfield-solar-plus-storage-project-in-new-zealand/,trade,
2026-06-17,Limited synergies and profitability drive Wärtsilä’s energy storage divestment,"Wärtsilä spinning out its energy storage activities and divesting a 50% stake this week reflects difficulties in making the business profitable and synergistic within the wider group activities, analysts said.",Global,,market,,0,0,NA,,,[],"{'state_or_länder': '', 'city': '', 'grid_zone': ''}",2026-06-17,3,"['utility-scale', 'storage']",Energy Storage News,https://www.energy-storage.news/limited-synergies-and-profitability-drive-wartsilas-energy-storage-divestment/,trade,
2026-06-17,EU Roundup: Octopus and Eco Stor financing deals for large-scale BESS in Italy and Germany enable 1.6GWh of capacity,"Octopus Energy Generation has partnered with ZE Energy to invest in and build one of Italy's biggest BESS projects, while Eco Stor has secured financing for one of Germany's, which it is already building. Optimiser Entrix has also won two large contracts in Germany and the Netherlands.",Germany,DE,project,,0,0,NA,,,[],"{'state_or_länder': '', 'city': '', 'grid_zone': ''}",2026-06-17,3,"['utility-scale', 'storage']",Energy Storage News,https://www.energy-storage.news/eu-roundup-octopus-and-eco-stor-financing-deals-for-large-scale-bess-in-italy-and-germany-enable-1-6gwh-of-capacity/,trade,
2026-06-17,Solar Energy Corporation of India invites bids for 4.8GWh of energy storage-backed FDRE capacity,"SECI is inviting bids for 4,800MWh of firm and dispatchable renewable energy (FDRE) capacity supported by co-located energy storage.",India,IN,tender,,0,0,NA,,,[],"{'state_or_länder': '', 'city': '', 'grid_zone': ''}",2026-06-17,3,"['utility-scale', 'PV', 'storage']",Energy Storage News,https://www.energy-storage.news/solar-energy-corporation-of-india-invites-bids-for-4-8gwh-of-energy-storage-backed-fdre-capacity/,trade,
2026-06-17,14.6GWh of BESS deployed globally in May; activity up 24% in 2026 so far,"Around 4.9GW/14.6GWh of large-scale BESS came online in May, with a much more balanced regional breakdown than usual.",Global,,market,,0,0,NA,,,[],"{'state_or_länder': '', 'city': '', 'grid_zone': ''}",2026-06-17,3,"['utility-scale', 'storage']",Energy Storage News,https://www.energy-storage.news/14-6gwh-of-bess-deployed-globally-in-may-activity-up-24-in-2026-so-far/,trade,
2026-06-17,"Southeast Asia’s BESS developers must ‘engage early with regulators, utilities and communities’","Developers of battery storage projects across Southeast Asia must heed lessons learned elsewhere and engage with key stakeholders as early as possible, Energy-Storage.news has heard.",Global,,project,,0,0,NA,,,[],"{'state_or_länder': '', 'city': '', 'grid_zone': ''}",2026-06-17,3,"['utility-scale', 'storage']",Energy Storage News,https://www.energy-storage.news/southeast-asias-bess-developers-must-engage-early-with-regulators-utilities-and-communities/,trade,
2026-06-16,"US Roundup: Virginia’s biggest standalone BESS, Cypress Creek raises US$3.5 billion and Kore sells mobile battery business","Virginia’s biggest standalone BESS comes online, Cypress Creek raises funding for a gigawatt-scale hybrid resource, and Kore Power’s mobile solutions subsidiary is sold, in this edition of news in brief.",Global,,tech,,0,0,NA,,,[],"{'state_or_länder': '', 'city': '', 'grid_zone': ''}",2026-06-16,5,"['utility-scale', 'PV+BESS', 'storage']",Energy Storage News,https://www.energy-storage.news/us-roundup-virginias-biggest-standalone-bess-cypress-creek-raises-us3-5-billion-and-kore-sells-mobile-battery-business/,trade,
2026-06-16,5GW Bogunda wind project in Australia reconfigured as 1.85GW hybrid with 500MW solar and 2GWh of battery capacity,"Brisbane-based developer Renewable Energy Partners (REP) has expanded the Bogunda Energy Hub to include solar PV and battery energy storage, with the project now formally in early-stage development south of Hughenden in Queensland, Australia.",Global,,project,,0,0,NA,,,[],"{'state_or_länder': '', 'city': '', 'grid_zone': ''}",2026-06-16,4,"['utility-scale', 'PV+BESS', 'wind', 'PV', 'storage']",PV-Tech,https://www.pv-tech.org/5gw-bogunda-wind-project-in-australia-reconfigured-as-1-85gw-hybrid-with-500mw-solar-and-2gwh-of-battery-capacity/,trade,
2026-06-16,Ontario IESO procures 640MW energy storage in LT2 Request for Proposals,"Ontario, Canada’s Independent Electricity System Operator (IESO) has secured 640MW of new capacity through three projects selected under the capacity stream of the Second Long-Term Request for Proposals (LT2).",Global,,project,,0,0,NA,,,[],"{'state_or_länder': '', 'city': '', 'grid_zone': ''}",2026-06-16,4,"['utility-scale', 'storage']",Energy Storage News,https://www.energy-storage.news/ontario-ieso-procures-640mw-energy-storage-in-lt2-request-for-proposals/,trade,
2026-06-16,Australia’s Energy Security Corporation’s debut investment backs 650MW Ausgrid battery storage platform,"The NSW Energy Security Corporation has deployed its first investment, committing AU$100 million to a large-scale battery storage platform.",Global,,tech,,0,0,NA,,,[],"{'state_or_länder': '', 'city': '', 'grid_zone': ''}",2026-06-16,4,"['utility-scale', 'storage']",Energy Storage News,https://www.energy-storage.news/australias-energy-security-corporations-debut-investment-backs-650mw-ausgrid-battery-storage-platform/,trade,
2026-06-16,European inverter manufacturing capacity surpasses 100GW,"European inverter manufacturing capacity has now surpassed 100GW, according to figures from PV Tech Market Research.",Europe,EU,tech,,0,0,NA,,,[],"{'state_or_länder': '', 'city': '', 'grid_zone': ''}",2026-06-16,3,"['utility-scale', 'PV']",PV-Tech,https://www.pv-tech.org/european-inverter-manufacturing-capacity-surpasses-100gw/,trade,
2026-06-16,US solar developers are getting creative—and risky—ahead of the safe harbour deadline,"PV Tech Premium sat down with Anne Loomis, partner at Troutman Pepper Locke, to discuss the safe harbour deadline for US solar developers.",Global,,market,,0,0,NA,,,[],"{'state_or_länder': '', 'city': '', 'grid_zone': ''}",2026-06-16,3,"['utility-scale', 'PV']",PV-Tech,https://www.pv-tech.org/us-solar-developers-are-getting-creative-and-risky-ahead-of-the-safe-harbour-deadline/,trade,
2026-06-16,MPC begins testing and commissioning work at 66.1MW Guatemala solar PV project,Dutch IPP MPC Energy Solutions has started testing and commissioning work at its 66.1MW San Patricio solar PV project in Guatemala.,Global,,project,,0,0,NA,,,[],"{'state_or_länder': '', 'city': '', 'grid_zone': ''}",2026-06-16,3,"['utility-scale', 'PV']",PV-Tech,https://www.pv-tech.org/mpc-begins-testing-commissioning-work-66-1mw-guatemala-solar-pv-project/,trade,
2026-06-16,Ember: Spain’s replacement of gas with renewable energy has delivered bill savings of 19%,"The deployment of renewable energy capacity in Spain has driven a decoupling from volatile global gas prices, resulting in a 19% reduction in consumer electricity bills.",Global,,price,,0,0,NA,,,[],"{'state_or_länder': '', 'city': '', 'grid_zone': ''}",2026-06-16,3,['utility-scale'],PV-Tech,https://www.pv-tech.org/ember-spains-replacement-gas-renewable-energy-delivered-bill-savings-19/,trade,
2026-06-16,‘Everyone’s too enamoured with low price to the detriment of what they’re going to get for that’,"PV Talk: Todd Heffner explains what are the most common issues he's dealt in solar litigations, as well as the importance of finding the right experts.",Global,,price,,0,0,NA,,,[],"{'state_or_länder': '', 'city': '', 'grid_zone': ''}",2026-06-16,3,"['utility-scale', 'PV']",PV-Tech,https://www.pv-tech.org/everyones-too-enamoured-with-low-price-to-the-detriment-of-what-theyre-going-to-get-for-that/,trade,
2026-06-16,"Energy Dome, Invinity Energy Systems advance non-lithium LDES projects in the US","Energy Dome is advancing a 10-hour CO2 Battery project in Arizona, with SRP and Google, while Invinity announces the sale of North America’s largest VRFB, in California.",Global,,project,,0,0,NA,,,[],"{'state_or_länder': '', 'city': '', 'grid_zone': ''}",2026-06-16,3,"['utility-scale', 'storage']",Energy Storage News,https://www.energy-storage.news/energy-dome-invinity-energy-systems-advance-non-lithium-ldes-projects-in-the-us/,trade,
2026-06-16,AESC signs 10GWh US domestic content BESS cell and module deal with system integrator Prevalon,AESC has announced a strategic supply partnership with BESS system integrator Prevalon Energy.,Global,,tech,,0,0,NA,,,[],"{'state_or_länder': '', 'city': '', 'grid_zone': ''}",2026-06-16,3,"['utility-scale', 'storage']",Energy Storage News,https://www.energy-storage.news/aesc-signs-10gwh-us-domestic-content-bess-cell-and-module-deal-with-system-integrator-prevalon/,trade,
2026-06-16,Western Power begins work on 18 new community batteries in Western Australia,Western Power has started construction on 18 community battery energy storage systems across Perth and Bunbury in Western Australia.,Global,,project,,0,0,NA,,,[],"{'state_or_länder': '', 'city': '', 'grid_zone': ''}",2026-06-16,3,"['utility-scale', 'storage']",Energy Storage News,https://www.energy-storage.news/western-power-begins-work-on-18-new-community-batteries-in-western-australia/,trade,
2026-06-15,HVR Solar signs agreements for 1.2GW TOPCon cell manufacturing facility in Uttar Pradesh,"HVR Solar has signed a series of agreements to develop of a 1.2GW TOPCon solar cell manufacturing plant in Amroha, Uttar Pradesh.",Global,,market,,0,0,NA,,,[],"{'state_or_länder': '', 'city': '', 'grid_zone': ''}",2026-06-15,3,"['utility-scale', 'PV']",PV-Tech,https://www.pv-tech.org/hvr-solar-signs-agreements-for-1-2gw-topcon-cell-manufacturing-facility-in-uttar-pradesh/,trade,
2026-06-15,"SECI launches 4,800MWh FDRE tender backed by co-located energy storage","SECI is inviting bids for 4,800MWh of firm and dispatchable renewable energy capacity supported by co-located energy storage systems.",India,IN,tender,,0,0,NA,,,[],"{'state_or_länder': '', 'city': '', 'grid_zone': ''}",2026-06-15,3,"['utility-scale', 'storage']",PV-Tech,https://www.pv-tech.org/seci-launches-4800mwh-fdre-tender-backed-by-co-located-energy-storage/,trade,
2026-06-15,Enphase launches IQ9N microinverter for European residential solar,"Enphase Energy has launched its IQ9N Microinverter, which uses gallium nitride (GaN) technology, for the European residential solar sector.",Europe,EU,tech,,0,0,NA,,,[],"{'state_or_länder': '', 'city': '', 'grid_zone': ''}",2026-06-15,3,"['utility-scale', 'PV']",PV-Tech,https://www.pv-tech.org/enphase-launches-iq9n-microinverter-european-residential-solar/,trade,
2026-06-15,"CPUC finalises community solar scheme, CLASS argues programme is ‘destined for continued failure’","CPUC has finalised details of its community solar, which has been dismissed as 'unworkable and destined for continued failure' by CLASS.",Global,,market,,0,0,NA,,,[],"{'state_or_länder': '', 'city': '', 'grid_zone': ''}",2026-06-15,3,"['utility-scale', 'PV']",PV-Tech,https://www.pv-tech.org/cpuc-finalises-community-solar-scheme-class-destined-for-continued-failure/,trade,
