date_utc,headline,summary_80w,region,country,category,subtopic,capacity_MW,storage_MWh,project_stage,tariff_or_price_local,tariff_or_price_usd,entities,location,effective_date,impact_score_1to5,tags,source_name,source_url,reliability,notes
2026-03-10,Tunisia issues call for 300MW/150MW solar-plus-storage project,The Tunisian government is seeking proposals for a 300MW/150MW solar-plus-storage project in the south of the country.,Global,,project,,0,0,NA,,,[],"{'state_or_länder': '', 'city': '', 'grid_zone': ''}",2026-03-10,4,"['utility-scale', 'PV', 'storage']",PV-Tech,https://www.pv-tech.org/tunisia-issues-call-for-300mw-150mw-solar-plus-storage-project/,trade,
2026-03-10,"Argentina launches 700MW/2,800MWh BESS tender",The Argentinian Government has launched a new battery energy storage system (BESS) tender seeking 700MW and 4-hour duration.,Global,,tender,,0,0,NA,,,[],"{'state_or_länder': '', 'city': '', 'grid_zone': ''}",2026-03-10,4,"['utility-scale', 'storage']",Energy Storage News,https://www.energy-storage.news/argentina-launches-700mw-2800mwh-bess-tender/,trade,
2026-03-10,Data centre energy pledge unlikely to benefit solar PV,"Amazon, Google, OpenAI and other tech firms have signed the 'ratepayer protection pledge' to build, bring or buy the energy required to build and operate data centres.",Global,,market,,0,0,NA,,,[],"{'state_or_länder': '', 'city': '', 'grid_zone': ''}",2026-03-10,3,"['utility-scale', 'PV']",PV-Tech,https://www.pv-tech.org/data-centre-energy-pledge-unlikely-to-benefit-solar-pv/,trade,
2026-03-10,US adds 43.2GW of new solar PV capacity in 2025,"The US installed 43.2GW of new solar PV capacity in 2025, a 14% decrease from the previous year, according to data from the Solar Energy Industries Association (SEIA) and Wood Mackenzie.",Global,,market,,0,0,NA,,,[],"{'state_or_länder': '', 'city': '', 'grid_zone': ''}",2026-03-10,3,"['utility-scale', 'PV']",PV-Tech,https://www.pv-tech.org/us-adds-43-2gw-of-new-solar-pv-capacity-in-2025/,trade,
2026-03-10,"EUROPE ROUND-UP: Sonnedix, Helleniq Energy and others close European solar PV deals","A roundup of European solar stories, with developments from Sonnedix, Helleniq, Nuveen Infrastructure and Nord/LB.",Europe,EU,market,,0,0,NA,,,[],"{'state_or_länder': '', 'city': '', 'grid_zone': ''}",2026-03-10,3,"['utility-scale', 'PV']",PV-Tech,https://www.pv-tech.org/europe-round-up-sonnedix-helleniq-energy-and-others-close-european-solar-pv-deals/,trade,
2026-03-10,‘It’s always about LCOE’ – GameChange Solar CEO on Terrasmart and sector consolidation,"PV Tech Premium spoke with Philip Vyhanek, CEO of GameChange Solar, about the company's purchase of Terrasmart and wider solar industry dynamics.",Global,,price,,0,0,NA,,,[],"{'state_or_länder': '', 'city': '', 'grid_zone': ''}",2026-03-10,3,"['utility-scale', 'PV']",PV-Tech,https://www.pv-tech.org/its-always-about-lcoe-gamechange-solar-ceo-on-terrasmart-and-sector-consolidation/,trade,
2026-03-10,NSW approves 15MW green hydrogen project powered by Wathagar solar PV plant in Australia,"The New South Wales (NSW) government has approved the 15MW Good Earth Green Hydrogen and Ammonia project in Moree, Australia.",Global,,project,,0,0,NA,,,[],"{'state_or_länder': '', 'city': '', 'grid_zone': ''}",2026-03-10,3,"['utility-scale', 'PV']",PV-Tech,https://www.pv-tech.org/nsw-approves-15mw-green-hydrogen-project-powered-by-wathagar-solar-pv-plant-in-australia/,trade,
2026-03-10,"Long-duration tech still outcompeted by lithium, trade group advocates for ‘valuing diversity’","Global long-duration energy storage (LDES) deployment figures soared in 2025, but newer technologies risk being outcompeted by the incumbent, lithium-ion (Li-ion).",Global,,market,,0,0,NA,,,[],"{'state_or_länder': '', 'city': '', 'grid_zone': ''}",2026-03-10,3,"['utility-scale', 'storage']",Energy Storage News,https://www.energy-storage.news/long-duration-tech-still-outcompeted-by-lithium-trade-group-advocates-for-valuing-diversity/,trade,
2026-03-10,"IPP Econergy’s head of energy storage talks pipeline, financing, Germany, procurement and pricing","Joshua Murphy, head of energy storage for IPP Econergy, sat down with Energy-Storage.news for a video interview to discuss various business and financial topics at the Energy Storage Summit 2026 in London last month.",Germany,DE,market,,0,0,NA,,,[],"{'state_or_länder': '', 'city': '', 'grid_zone': ''}",2026-03-10,3,"['utility-scale', 'storage']",Energy Storage News,https://www.energy-storage.news/ipp-econergys-head-of-energy-storage-talks-pipeline-financing-germany-procurement-and-pricing/,trade,
2026-03-10,Base Power launches 100MW VPP programme in Texas,"Residential energy storage startup Base Power is collaborating with utility Denton County Electric Cooperative (CoServ) to deploy 100MW of residential energy storage across North Texas, US.",Global,,market,,0,0,NA,,,[],"{'state_or_länder': '', 'city': '', 'grid_zone': ''}",2026-03-10,3,"['utility-scale', 'storage']",Energy Storage News,https://www.energy-storage.news/base-power-launches-100mw-vpp-programme-in-texas/,trade,
2026-03-10,"From software to shareholder: Flower, Volkswagen’s Elli and Nuvve launch Germany &  Sweden BESS projects","Software and optimisation firms Flower, Volkswagen's Elli and Nuvve have progressed large-scale BESS projects under own-and-operate models; Flower and Elli in Germany and the latter in Sweden.",Germany,DE,project,,0,0,NA,,,[],"{'state_or_länder': '', 'city': '', 'grid_zone': ''}",2026-03-10,3,"['utility-scale', 'storage']",Energy Storage News,https://www.energy-storage.news/from-software-to-shareholder-flower-volkswagens-elli-and-nuvve-launch-germany-sweden-bess-projects/,trade,
2026-03-10,Octopus Australia breaks ground on 486MWh Blind Creek Solar Farm and Battery project,Octopus Australia has broken ground on the 486MWh Blind Creek Solar Farm and Battery site in New South Wales (NSW).,Global,,project,,0,0,NA,,,[],"{'state_or_länder': '', 'city': '', 'grid_zone': ''}",2026-03-10,3,"['utility-scale', 'PV', 'storage']",Energy Storage News,https://www.energy-storage.news/octopus-australia-breaks-ground-on-486mwh-blind-creek-solar-farm-and-battery-project/,trade,
2026-03-10,Australia: NSW planners approve 400MWh Burroway solar-plus-storage despite community objections,The NSW Independent Planning Commission has approved Edify Energy's 400MWh Burroway solar-plus-storage project in Australia.,Global,,project,,0,0,NA,,,[],"{'state_or_länder': '', 'city': '', 'grid_zone': ''}",2026-03-10,3,"['utility-scale', 'PV', 'storage']",Energy Storage News,https://www.energy-storage.news/australia-nsw-planners-approve-400mwh-burroway-solar-plus-storage-despite-community-objections/,trade,
2026-03-09,Fortescue begins construction on Western Australia’s ‘largest’ solar PV power plant,Mining giant Fortescue has begun construction of its 440MW Solomon Airport solar PV power plant in Western Australia's Pilbara region.,Global,,project,,0,0,NA,,,[],"{'state_or_länder': '', 'city': '', 'grid_zone': ''}",2026-03-09,4,"['utility-scale', 'PV']",PV-Tech,https://www.pv-tech.org/fortescue-begins-construction-on-western-australias-largest-solar-pv-power-plant/,trade,
2026-03-09,US import tariffs ‘increase the policy risk’ for BESS,"Energy-Storage.news speaks with Isshu Kikuma, energy storage analyst at BloombergNEF (BNEF), ahead of the upcoming Energy Storage Summit USA.",Global,,policy,,0,0,NA,,,[],"{'state_or_länder': '', 'city': '', 'grid_zone': ''}",2026-03-09,4,"['utility-scale', 'storage']",Energy Storage News,https://www.energy-storage.news/us-import-tariffs-increase-the-policy-risk-for-bess/,trade,
2026-03-09,Origin Energy’s 650MWh grid-forming BESS begins commissioning in Australia,"Origin Energy's 300MW/650MWh Mortlake BESS has entered AEMO's MMS, marking the facility’s transition into its commissioning phase.",Global,,project,,0,0,NA,,,[],"{'state_or_länder': '', 'city': '', 'grid_zone': ''}",2026-03-09,4,"['utility-scale', 'storage']",Energy Storage News,https://www.energy-storage.news/origin-energys-650mwh-grid-forming-bess-begins-commissioning-in-australia/,trade,
2026-03-09,Zelestra secures US$176 million financing for 242MWdc PV project in Peru,Spanish independent power producer (IPP) Zelestra has secured a US$176 million green financing package for its 242MWdc Babilonia solar project in Peru.,Global,,project,,0,0,NA,,,[],"{'state_or_länder': '', 'city': '', 'grid_zone': ''}",2026-03-09,3,"['utility-scale', 'PV']",PV-Tech,https://www.pv-tech.org/zelestra-secures-us176-million-financing-for-242mwdc-pv-project-in-peru/,trade,
2026-03-09,"Polysilicon prices plunge, with maximum decline exceeding 12%","The latest domestic solar-grade polysilicon transaction prices from the Silicon Industry Branch of the China Nonferrous Metals Industry Association show that all domestic n-type solar-grade polysilicon products have plunged, with steep declines across the board.",Global,,price,,0,0,NA,,,[],"{'state_or_länder': '', 'city': '', 'grid_zone': ''}",2026-03-09,3,"['utility-scale', 'PV']",PV-Tech,https://www.pv-tech.org/polysilicon-prices-plunge-with-maximum-decline-exceeding-12/,trade,
2026-03-09,Midsummer secures US$25.5 million thin-film CIGS equipment follow-up order,Swedish thin-film solar manufacturer Midsummer has received a follow-up machinery order worth SEK236 million (US$25.5 million).,Global,,market,,0,0,NA,,,[],"{'state_or_länder': '', 'city': '', 'grid_zone': ''}",2026-03-09,3,"['utility-scale', 'PV']",PV-Tech,https://www.pv-tech.org/midsummer-secures-us25-5-million-thin-film-cigs-equipment-follow-up-order/,trade,
2026-03-09,Lyra Energy secures financing for 255MW PV project in South Africa,"Renewable energy platform Lyra Energy has reached financial close on its 255MW solar PV project in Thakadu, South Africa.",Global,,project,,0,0,NA,,,[],"{'state_or_länder': '', 'city': '', 'grid_zone': ''}",2026-03-09,3,"['utility-scale', 'PV']",PV-Tech,https://www.pv-tech.org/lyra-energy-secures-financing-for-255mw-pv-project-in-south-africa/,trade,
2026-03-09,Solar and storage boost to tackle energy affordability in New Jersey,"Clean energy advocates have applauded new measures to expand solar and storage capacity in New Jersey and tackle rising energy bills, including a 3GW boost to the state’s community energy programme.",Global,,market,,0,0,NA,,,[],"{'state_or_länder': '', 'city': '', 'grid_zone': ''}",2026-03-09,3,"['utility-scale', 'PV', 'storage']",PV-Tech,https://www.pv-tech.org/solar-and-storage-boost-to-tackle-energy-affordability-in-new-jersey/,trade,
2026-03-09,Qcells resumes normal US solar module production after UFLPA detainments,Hanwha Qcells has resumed normal production at its solar module assembly plants in the US state of Georgia after some of its products were detained by US customs.,Global,,tech,,0,0,NA,,,[],"{'state_or_länder': '', 'city': '', 'grid_zone': ''}",2026-03-09,3,"['utility-scale', 'PV']",PV-Tech,https://www.pv-tech.org/qcells-resumes-normal-us-solar-module-production-after-uflpa-detainments/,trade,
2026-03-09,Australia and Canada establish five-pillar clean energy partnership framework,"Australia &#038; Canada have signed their first bilateral Clean Energy Partnership, establishing a framework for cooperation across five key areas.",Global,,market,,0,0,NA,,,[],"{'state_or_länder': '', 'city': '', 'grid_zone': ''}",2026-03-09,3,['utility-scale'],PV-Tech,https://www.pv-tech.org/australia-and-canada-establish-five-pillar-clean-energy-partnership-framework/,trade,
2026-03-09,Hanjung America to build ESS manufacturing facility in Indiana to support StarPlus Energy,"Hanjung America, a subsidiary of South Korea-based battery manufacturer Hanjung NCS, will build its first US energy storage system (ESS) manufacturing facility in Huntington, Indiana, US.",India,IN,tech,,0,0,NA,,,[],"{'state_or_länder': '', 'city': '', 'grid_zone': ''}",2026-03-09,3,"['utility-scale', 'storage']",Energy Storage News,https://www.energy-storage.news/hanjung-america-to-build-ess-manufacturing-facility-in-indiana-to-support-starplus-energy/,trade,
2026-03-09,EU ‘Made in Europe’ regulation welcomed but ‘will not remove dependency on China’,A European Commission (EC) proposal to add domestic content requirements for energy storage will ‘significantly impact’ the industry but may not reduce overall dependence on China.,Europe,EU,policy,,0,0,NA,,,[],"{'state_or_länder': '', 'city': '', 'grid_zone': ''}",2026-03-09,3,"['utility-scale', 'storage']",Energy Storage News,https://www.energy-storage.news/eu-made-in-europe-regulation-welcomed-but-will-not-remove-dependency-on-china/,trade,
2026-03-06,Origis Energy secures US$545 million for 413MW Texas PV portfolio,Origis Energy has secured US$545 million in financing for three utility-scale solar projects with a combined capacity of 413MW in Texas.,Global,,project,,0,0,NA,,,[],"{'state_or_länder': '', 'city': '', 'grid_zone': ''}",2026-03-06,4,"['utility-scale', 'PV']",PV-Tech,https://www.pv-tech.org/origis-secures-us545-million-for-413mw-texas-pv-portfolio/,trade,
2026-03-06,TotalEnergies ramps up 61MW unit at Iraq’s 1GW Basra solar project,French energy major TotalEnergies has initiated pilot operations of the first generating unit at its 1GW solar farm in Iraq’s Basra region.,Global,,project,,0,0,NA,,,[],"{'state_or_länder': '', 'city': '', 'grid_zone': ''}",2026-03-06,3,"['utility-scale', 'PV']",PV-Tech,https://www.pv-tech.org/totalenergies-ramps-up-61mw-unit-at-iraqs-1gw-basra-solar-project/,trade,
2026-03-06,Silfab Solar slams ‘misinformation’ over chemical ‘leak’ at South Carolina solar module factory,"US solar manufacturer Silfab Solar has disputed some reports of chemical spillages at its manufacturing facility in Fort Mill, South Carolina.",Global,,tech,,0,0,NA,,,[],"{'state_or_länder': '', 'city': '', 'grid_zone': ''}",2026-03-06,3,"['utility-scale', 'PV']",PV-Tech,https://www.pv-tech.org/silfab-solar-slams-misinformation-over-chemical-leak-at-south-carolina-solar-module-factory/,trade,
2026-03-06,Zelestra begins construction on 441MWdc solar portfolio in Texas,Spanish independent power producer (IPP) Zelestra has begun the construction of 253MWdc Echols Grove and 188MWdc Cedar Range projects in Texas.,Global,,project,,0,0,NA,,,[],"{'state_or_länder': '', 'city': '', 'grid_zone': ''}",2026-03-06,3,"['utility-scale', 'PV']",PV-Tech,https://www.pv-tech.org/zelestra-begins-construction-on-441mwdc-solar-portfolio-in-texas/,trade,
2026-03-06,Silfab Solar pauses operations at module & cell factory after chemical spills,Silfab solar has paused operations at its module manufacturing plant in South Carolina following chemical spills.,Global,,tech,,0,0,NA,,,[],"{'state_or_länder': '', 'city': '', 'grid_zone': ''}",2026-03-06,3,"['utility-scale', 'PV']",PV-Tech,https://www.pv-tech.org/silfab-solar-pauses-operations-at-module-cell-factory-after-chemical-spills/,trade,
2026-03-06,Portland General Electric finalises agreements for 1GW renewables and BESS,"Portland General Electric (PGE) has finalised agreements for more than 1,000MW of new renewable energy and battery energy storage system (BESS) projects in the US state of Oregon.",Global,,project,,0,0,NA,,,[],"{'state_or_länder': '', 'city': '', 'grid_zone': ''}",2026-03-06,3,"['utility-scale', 'storage']",PV-Tech,https://www.pv-tech.org/portland-general-electric-finalises-agreements-for-1gw-renewables-and-bess/,trade,
2026-03-06,Sungrow and Delta Capacity sign 1GWh European framework BESS supply deal,Inverter and BESS firm Sungrow and BESS owner-operator Delta Capacity signed a 1GWh framework supply agreement for European projects at the Energy Storage Summit 2026 in London last week.,Europe,EU,project,,0,0,NA,,,[],"{'state_or_länder': '', 'city': '', 'grid_zone': ''}",2026-03-06,3,"['utility-scale', 'storage']",Energy Storage News,https://www.energy-storage.news/sungrow-and-delta-capacity-sign-1gwh-european-framework-bess-supply-deal/,trade,
2026-03-06,Thailand’s energy storage market lags despite renewable push and upstream manufacturing support,"Thailand is increasing its renewable generation but its energy storage market still lags behind, while there is support for the upstream industry, writes analyst Charlotte Gisbourne.",Global,,market,,0,0,NA,,,[],"{'state_or_länder': '', 'city': '', 'grid_zone': ''}",2026-03-06,3,"['utility-scale', 'storage']",Energy Storage News,https://www.energy-storage.news/thailands-energy-storage-market-lags-despite-renewable-push-and-upstream-manufacturing-support/,trade,
2026-03-06,Australia: Construction starts on Hunter-Central Coast REZ in New South Wales,"Construction has officially commenced on a network upgrade in Australia’s New South Wales Upper Hunter region, which is set to boost transfer capacity by at least 1GW by 2028, in support of the state’s renewable energy transition.",Global,,project,,0,0,NA,,,[],"{'state_or_länder': '', 'city': '', 'grid_zone': ''}",2026-03-06,3,['utility-scale'],Energy Storage News,https://www.energy-storage.news/australia-construction-starts-on-hunter-central-coast-rez-in-new-south-wales/,trade,
2026-03-06,Australia’s Cheaper Home Batteries Program reportedly under review as government seeks budget savings,"The Australian government is reportedly exploring additional modifications to its Cheaper Home Batteries Program, including the possibility of an early wind-up, as the government seeks budget savings ahead of the May federal budget.",Global,,market,,0,0,NA,,,[],"{'state_or_länder': '', 'city': '', 'grid_zone': ''}",2026-03-06,3,"['utility-scale', 'wind']",Energy Storage News,https://www.energy-storage.news/australias-cheaper-home-batteries-program-reportedly-under-review-as-government-seeks-budget-savings/,trade,
2026-03-05,"Arevon powers 430MW Missouri PV project, boosts state solar capacity by 50%",US independent power producer (IPP) Arevon has begun operations at its 430MW Kelso solar PV project in the state of Missouri.,Global,,project,,0,0,NA,,,[],"{'state_or_länder': '', 'city': '', 'grid_zone': ''}",2026-03-05,4,"['utility-scale', 'PV']",PV-Tech,https://www.pv-tech.org/arevon-powers-430mw-missouri-pv-project-boosts-state-solar-capacity-by-50/,trade,
2026-03-05,China’s VAT change confirms scale alone no longer defines competitiveness in PV manufacturing,"Policy shifts in China mean PV manufacturers will need operational discipline and clear technology roadmaps to compete, writes LONGi's Charles Jiang.",Global,,policy,,0,0,NA,,,[],"{'state_or_länder': '', 'city': '', 'grid_zone': ''}",2026-03-05,4,"['utility-scale', 'PV']",PV-Tech,https://www.pv-tech.org/chinas-vat-change-confirms-scale-alone-no-longer-defines-competitiveness-in-pv-manufacturing/,trade,
2026-03-05,Policy and regulation risks are a common theme in Europe and US energy storage markets,"In this second part of our interview with Wood Mackenzie energy storage analysts, we look at risk factors and mitigation across the European and US markets.",Europe,EU,policy,,0,0,NA,,,[],"{'state_or_länder': '', 'city': '', 'grid_zone': ''}",2026-03-05,4,"['utility-scale', 'storage']",Energy Storage News,https://www.energy-storage.news/policy-and-regulation-risks-are-a-common-theme-in-europe-and-us-energy-storage-markets/,trade,
2026-03-05,Why the Middle East crisis could prompt a doubling down on solar,"Analysis: Just as the energy crisis following Russia’s invasion of Ukraine led to a European pivot on clean energy, the US-Israel war on Iran presents another potential turning point, this time with a wider global reach.",Europe,EU,market,,0,0,NA,,,[],"{'state_or_länder': '', 'city': '', 'grid_zone': ''}",2026-03-05,3,"['utility-scale', 'PV']",PV-Tech,https://www.pv-tech.org/why-the-middle-east-crisis-could-prompt-a-doubling-down-on-solar/,trade,
2026-03-05,Trinasolar launches Vertex S+ G3 and Vertex N G3 ranges of i-TOPCon modules,"Trinasolar has launched two new series of i-TOPCON solar PV modules, the Vertex S+ G3 range and the Vertex N G3 series.",Global,,tech,,0,0,NA,,,[],"{'state_or_länder': '', 'city': '', 'grid_zone': ''}",2026-03-05,3,"['utility-scale', 'PV']",PV-Tech,https://www.pv-tech.org/trinasolar-launches-vertex-s-g3-vertex-n-g3-ranges-i-topcon-modules/,trade,
2026-03-05,Enery closes US$534 million in finance for Romanian solar-plus-storage project,"Enery has closed a €460 million (US$534 million) syndicated green project financing for a 761MWp solar, 1GWh-plus BESS project in Romania.",Global,,project,,0,0,NA,,,[],"{'state_or_länder': '', 'city': '', 'grid_zone': ''}",2026-03-05,3,"['utility-scale', 'PV', 'storage']",PV-Tech,https://www.pv-tech.org/enery-closes-us534-million-finance-romanian-solar-plus-storage-project/,trade,
2026-03-05,Europe’s ‘Made in EU’ plans draw mixed reactions from solar industry,The EU’s “Industrial Accelerator Act” (IAA) for key domestic manufacturing sectors has been met with mixed reactions by the continent’s solar industry.,Europe,EU,market,,0,0,NA,,,[],"{'state_or_länder': '', 'city': '', 'grid_zone': ''}",2026-03-05,3,"['utility-scale', 'PV']",PV-Tech,https://www.pv-tech.org/europes-made-in-eu-plans-draw-mixed-reactions-from-solar-industry/,trade,
2026-03-05,Potentia Energy completes module installation at 98MW Quorn Park hybrid project,"Potentia has completed the installation of nearly 161,000 solar modules at its Quorn Park hybrid solar-plus-BESS in Australia.",Global,,project,,0,0,NA,,,[],"{'state_or_länder': '', 'city': '', 'grid_zone': ''}",2026-03-05,3,"['utility-scale', 'PV+BESS', 'PV', 'storage']",PV-Tech,https://www.pv-tech.org/potentia-energy-completes-module-installation-at-98mw-quorn-park-hybrid-project/,trade,
2026-03-05,Avantus secures US$300 million for 400MWh Arizona solar-plus-storage project,"Developer Avantus has closed a financing package of over US$300 million for the 100MWac/130MWdc solar, 400MWh BESS Kitt Solar and Energy Storage Project in Pinal County, Arizona, US.",Global,,project,,0,0,NA,,,[],"{'state_or_länder': '', 'city': '', 'grid_zone': ''}",2026-03-05,3,"['utility-scale', 'PV', 'storage']",Energy Storage News,https://www.energy-storage.news/avantus-secures-us300-million-for-400mwh-arizona-solar-plus-storage-project/,trade,
2026-03-05,"Redwood Energy positions second-life BESS as ‘essential infrastructure’ for US data centre load growth, domestic manufacturing needs","Energy-Storage.news Premium speaks with Claire McConnell, VP business development for Redwood Materials’ energy storage business, Redwood Energy, about its recent backing from Google and Nvidia, and what it has planned next.",Global,,market,,0,0,NA,,,[],"{'state_or_länder': '', 'city': '', 'grid_zone': ''}",2026-03-05,3,"['utility-scale', 'storage']",Energy Storage News,https://www.energy-storage.news/redwood-energy-positions-second-life-bess-as-essential-infrastructure-for-us-data-centre-load-growth-domestic-manufacturing-needs/,trade,
2026-03-05,"Bimergen acquires 79.2MW total of Texas BESS, Habitat advances Texas optimisation","From Texas, US, Bimergen Energy has acquired eight BESS projects totalling 79.2MW. Meanwhile, Habitat Energy announced its first US co-located solar-plus-storage partnership with Birch Creek.",Global,,project,,0,0,NA,,,[],"{'state_or_länder': '', 'city': '', 'grid_zone': ''}",2026-03-05,3,"['utility-scale', 'PV', 'storage']",Energy Storage News,https://www.energy-storage.news/bimergen-acquires-79-2mw-total-of-texas-bess-habitat-advances-texas-optimisation/,trade,
2026-03-05,"Grid-scale activity in Romania ramps up with gigawatts of announcements, led by Enery’s 1GWh financing","Large-scale BESS deployments in Romania are benefiting from country-specific drivers, helping Romania emerge as a busy grid-scale market.",Global,,market,,0,0,NA,,,[],"{'state_or_länder': '', 'city': '', 'grid_zone': ''}",2026-03-05,3,"['utility-scale', 'storage']",Energy Storage News,https://www.energy-storage.news/grid-scale-activity-in-romania-ramps-up-with-gigawatts-of-announcements-led-by-enerys-1gwh-financing/,trade,
2026-03-05,How Australia can turn the data centre boom into a grid growth story,Jeff Monday of Fluence believes Australia can transform its data centre boom from a grid constraint into a growth opportunity using BESS.,Global,,market,,0,0,NA,,,[],"{'state_or_länder': '', 'city': '', 'grid_zone': ''}",2026-03-05,3,"['utility-scale', 'storage']",Energy Storage News,https://www.energy-storage.news/how-australia-can-turn-the-data-centre-boom-into-a-grid-growth-story/,trade,
2026-03-05,Fluence completes ahead-of-schedule delivery of all enclosures to 600MWh BESS in Australia,Fluence has delivered all battery enclosures for the 600MWh Bulabul Battery storage project in New South Wales ahead of schedule.,Global,,project,,0,0,NA,,,[],"{'state_or_länder': '', 'city': '', 'grid_zone': ''}",2026-03-05,3,"['utility-scale', 'storage']",Energy Storage News,https://www.energy-storage.news/fluence-completes-ahead-of-schedule-delivery-of-all-enclosures-to-600mwh-bess-in-australia/,trade,
2026-03-04,Group Surya commissions 500MW G12R solar module manufacturing facility in India,"Group Surya has commissioned a G12R module manufacturing facility in Odisha, the first such manufacturing facility in the Indian state.",India,IN,project,,0,0,NA,,,[],"{'state_or_länder': '', 'city': '', 'grid_zone': ''}",2026-03-04,4,"['utility-scale', 'PV']",PV-Tech,https://www.pv-tech.org/group-surya-commissions-500mw-g12r-solar-module-manufacturing-facility-india/,trade,
